{
  "$schema": "https://json-schema.org/draft/2020-12/schema",
  "title": "pr.commits",
  "type": "object",
  "required": ["id", "type", "repo", "number", "commits", "total", "fetched_at"],
  "additionalProperties": false,
  "properties": {
    "id": { "type": "string", "minLength": 1 },
    "type": { "const": "pr.commits" },
    "repo": { "type": "string", "pattern": "^[A-Za-z0-9_.-]+/[A-Za-z0-9_.-]+$" },
    "number": { "type": "integer", "minimum": 1 },
    "title": { "type": "string", "minLength": 1 },
    "commits": {
      "type": "array",
      "minItems": 1,
      "maxItems": 100,
      "items": {
        "type": "object",
        "required": ["sha", "subject"],
        "additionalProperties": false,
        "properties": {
          "sha": { "type": "string", "pattern": "^[0-9a-f]{7,40}$" },
          "subject": { "type": "string", "minLength": 1 },
          "author": { "type": "string", "minLength": 1 }
        }
      }
    },
    "total": { "type": "integer", "minimum": 1 },
    "fetched_at": { "type": "string", "format": "date-time" }
  }
}
